[
  {
    "case_id": "rac_store_a_attribution_001",
    "question": "Can Store A's March-to-April increases in transaction amount and transaction orders be attributed to search exposure alone?",
    "question_type": "causal_diagnostic",
    "must_include_factors": [
      "search_exposure",
      "entry_conversion",
      "order_conversion",
      "promotion_intensity",
      "transaction_orders"
    ],
    "must_not_claim": [
      "Search exposure caused the March-to-April increases in transaction amount and transaction orders",
      "Search exposure alone explains the March-to-April increases in transaction amount and transaction orders",
      "The system proves causality",
      "The system has live Meituan backend access"
    ],
    "expected_confidence": "unknown"
  },
  {
    "case_id": "rac_cross_store_comparability_001",
    "question": "Are Stores B-F directly comparable in March 2026?",
    "question_type": "comparability_judgment",
    "must_include_factors": [
      "same_reporting_period",
      "store_type",
      "order_volume",
      "transaction_amount",
      "activity_intensity",
      "region_context",
      "competition",
      "sku_structure",
      "repeated_reporting_windows"
    ],
    "must_not_claim": [
      "Stores B-F are fully comparable",
      "Demo 2 implements a pairwise comparability gate",
      "Region type is a strong market classifier",
      "The system proves which store is better"
    ],
    "expected_confidence": "unknown"
  },
  {
    "case_id": "rac_promotion_strategy_001",
    "question": "What should be checked before changing promotions for a store?",
    "question_type": "strategic_recommendation",
    "must_include_factors": [
      "activity_orders",
      "activity_cost",
      "merchant_subsidy",
      "platform_subsidy",
      "order_conversion",
      "payment_conversion",
      "sku_margin_structure",
      "competitor_context"
    ],
    "must_not_claim": [
      "Promotion changes should be made based only on transaction amount",
      "Activity cost ratio is ROI",
      "One month of data is enough to prove promotion effectiveness",
      "The system can recommend final actions without checking margins"
    ],
    "expected_confidence": "unknown"
  },
  {
    "case_id": "rac_system_design_001",
    "question": "How should the RAC system be connected to the existing memory layer?",
    "question_type": "technical_design",
    "must_include_factors": [
      "typed_memory",
      "evidence_packets",
      "hypotheses",
      "belief_records",
      "confidence",
      "limitations",
      "retrieval_trace",
      "active_state_filtering"
    ],
    "must_not_claim": [
      "The system updates neural network weights",
      "The system has a true autonomous world model",
      "The system solves causal inference automatically",
      "The system should replace existing memory-layer endpoints immediately"
    ],
    "expected_confidence": "unknown"
  }
]
